{"$schema":"./nautilus-sandbox-request-v1.schema.json","authority":"CURRENT_CORE_TO_SANDBOX_ONE_WAY","current_reference":{"authority":"CURRENT_CORE_FACT_SOURCE","decision":{"action":"ENTER_LONG","decision_id":"decision_ethusdt_4h_enter_long_v1","instrument_id":"ETHUSDT.BINANCE","scheduled_for":"2026-08-05T04:00:00.000Z","strategy_policy_id":"FIXED_ETHUSDT_4H_COMPATIBILITY_V1"},"fixture_hash":"838e9ed89280bc524e355ec90f58e9c8f0b64703a331e7a36c169ecaeb14d09a","reference_hash":"2f946439001ef79877641004d40d56786ee59d652c286d3504305177e22ff49c","reference_id":"nautilus_current_reference_6e0ea83c3f9d370876132572367ad5ae5809411a4ec0890a04c173a782eb6025","risk_authorization":{"below_minimum_scenario_is_negative_test":true,"leverage":"1","maximum_notional":"40","maximum_position":"0.02","override_allowed":false,"short_allowed":false},"runtime_counters":{"broker_request_count":0,"credential_access_count":0,"network_request_count":0,"production_state_write_count":0,"real_order_count":0},"scenario_authorizations":[{"authorized_quantity":"0.0100","expected_terminal":"FILLED","scenario_id":"IMMEDIATE_FULL_FILL"},{"authorized_quantity":"0.0200","expected_terminal":"FILLED","scenario_id":"PARTIAL_THEN_FULL_FILL"},{"authorized_quantity":"0.0010","expected_terminal":"REJECTED_MIN_NOTIONAL","scenario_id":"BELOW_MINIMUM_REJECTION"},{"authorized_quantity":"0.0100","expected_terminal":"FILLED","scenario_id":"FRESH_PROCESS_REPLAY"}],"schema_version":"1.0.0","status":"CURRENT_REFERENCE_FROZEN_NO_RUNTIME_AUTHORITY","target":{"cash_account":true,"order_type":"MARKET","position_mode":"NETTING","side":"BUY","time_in_force":"GTC"}},"current_reference_hash":"2f946439001ef79877641004d40d56786ee59d652c286d3504305177e22ff49c","dependency_lock_hash":"eea3232a6494dad9500d8391234193222bc97a6992ba183c347e3a0f883e022d","engine_api":"LOW_LEVEL_BACKTEST_ENGINE","engine_count":1,"fixture":{"authority":{"credential_access_count":0,"historical_download_allowed":false,"live_data_allowed":false,"market_request_count":0,"production_state_write_count":0,"source":"COMMITTED_OFFLINE_FIXTURE"},"bar":{"close":"2000.00","close_time":"2026-08-05T04:00:00.000Z","high":"2010.00","low":"1970.00","open":"1980.00","open_time":"2026-08-05T00:00:00.000Z","volume":"100.0000"},"costs":{"funding_rate":"0","maker_fee_rate":"0.001","taker_fee_rate":"0.0015"},"fixture_hash":"838e9ed89280bc524e355ec90f58e9c8f0b64703a331e7a36c169ecaeb14d09a","fixture_id":"nautilus_sandbox_fixture_ethusdt_4h_v1","instrument":{"base_currency":"ETH","instrument_id":"ETHUSDT.BINANCE","interval":"4h","market":"SPOT","maximum_quantity":"9000","minimum_notional":"10","minimum_quantity":"0.0001","price_precision":2,"quote_currency":"USDT","size_precision":4,"step_size":"0.0001","tick_size":"0.01","venue":"BINANCE"},"scenarios":[{"authorized_quantity":"0.0100","expected_terminal":"FILLED","quotes":[{"ask_price":"2000.00","ask_size":"1.0000","bid_price":"1999.99","bid_size":"1.0000","timestamp":"2026-08-05T04:00:00.000Z"}],"scenario_id":"IMMEDIATE_FULL_FILL"},{"authorized_quantity":"0.0200","expected_terminal":"FILLED","quotes":[{"ask_price":"2000.00","ask_size":"0.0050","bid_price":"1999.99","bid_size":"1.0000","timestamp":"2026-08-05T04:00:00.000Z"},{"ask_price":"2000.10","ask_size":"0.0150","bid_price":"2000.09","bid_size":"1.0000","timestamp":"2026-08-05T04:00:01.000Z"}],"scenario_id":"PARTIAL_THEN_FULL_FILL"},{"authorized_quantity":"0.0010","expected_terminal":"REJECTED_MIN_NOTIONAL","quotes":[{"ask_price":"2000.00","ask_size":"1.0000","bid_price":"1999.99","bid_size":"1.0000","timestamp":"2026-08-05T04:00:00.000Z"}],"scenario_id":"BELOW_MINIMUM_REJECTION"},{"authorized_quantity":"0.0100","expected_terminal":"FILLED","quotes":[{"ask_price":"2000.00","ask_size":"1.0000","bid_price":"1999.99","bid_size":"1.0000","timestamp":"2026-08-05T04:00:00.000Z"}],"scenario_id":"FRESH_PROCESS_REPLAY"}],"schema_version":"1.0.0","starting_cash":"1000"},"fixture_hash":"838e9ed89280bc524e355ec90f58e9c8f0b64703a331e7a36c169ecaeb14d09a","live_adapter_allowed":false,"request_hash":"a8125bfc163dcb0fb13adbfe44a3d3dc5dcfa00e4fed95807d2fbedf650834aa","request_id":"nautilus_sandbox_request_7437fb396722b10a4a130618f59021ec649dcb71ec4ddf42a37a1af5fe7a3e9a","runtime_network_allowed":false,"scenario_ids":["IMMEDIATE_FULL_FILL","PARTIAL_THEN_FULL_FILL","BELOW_MINIMUM_REJECTION","FRESH_PROCESS_REPLAY"],"schema_version":"1.0.0","status":"SANDBOX_REQUEST_FROZEN_OFFLINE_ONLY"}
